,,Level,Kreis (2015),Kreis (2015),Kreis (2015),Kreis (2015),Kreis (2015),Kreis (2015),Kreis (2015),Kreis (2015),Kreis (2015),Kreis (2015),Kreis (2015),Kreis (2015),Kreis (2015),Kreis (2015),Kreis (2015),Kreis (2015),Kreis (2015),Kreis (2015),Kreis (2015),Kreis (2015),Kreis (2015),Kreis (2015),Kreis (2015),Kreis (2015),Kreis (2015),Kreis (2015),Kreis (2015),Kreis (2015),Kreis (2015),Kreis (2015),Kreis (2015),Kreis (2015),Kreis (2015),Kreis (2015),Kreis (2015),Kreis (2015),Kreis (2015),Kreis (2015),Kreis (2015),Kreis (2015),Kreis (2015),Kreis (2015),Kreis (2015),Kreis (2015),Kreis (2015),Kreis (2015),Kreis (2015),Kreis (2015),Kreis (2015),Kreis (2015),Kreis (2015),Kreis (2015),Kreis (2015),Kreis (2015),Kreis (2015),Kreis (2015),Kreis (2015),Kreis (2015),Kreis (2015)
,,Langname,Anteil der Zweitstimmen an den Wahlberechtigten in %,Anteil der Zweitstimmen an den Wahlberechtigten in %,Anteil der Zweitstimmen an den Wahlberechtigten in %,Anteil der Zweitstimmen an den Wahlberechtigten in %,Anteil der Zweitstimmen an den Wahlberechtigten in %,Anteil der Zweitstimmen an den Wahlberechtigten in %,Anteil der Zweitstimmen an den Wahlberechtigten in %,Anteil der Zweitstimmen CDU/CSU an den Zweitstimmen in %,Anteil der Zweitstimmen CDU/CSU an den Zweitstimmen in %,Anteil der Zweitstimmen CDU/CSU an den Zweitstimmen in %,Anteil der Zweitstimmen CDU/CSU an den Zweitstimmen in %,Anteil der Zweitstimmen CDU/CSU an den Zweitstimmen in %,Anteil der Zweitstimmen CDU/CSU an den Zweitstimmen in %,Anteil der Zweitstimmen CDU/CSU an den Zweitstimmen in %,Anteil der Zweitstimmen SPD an den Zweitstimmen in %,Anteil der Zweitstimmen SPD an den Zweitstimmen in %,Anteil der Zweitstimmen SPD an den Zweitstimmen in %,Anteil der Zweitstimmen SPD an den Zweitstimmen in %,Anteil der Zweitstimmen SPD an den Zweitstimmen in %,Anteil der Zweitstimmen SPD an den Zweitstimmen in %,Anteil der Zweitstimmen SPD an den Zweitstimmen in %,Anteil der Zweitstimmen Grüne an den Zweitstimmen in %,Anteil der Zweitstimmen Grüne an den Zweitstimmen in %,Anteil der Zweitstimmen Grüne an den Zweitstimmen in %,Anteil der Zweitstimmen Grüne an den Zweitstimmen in %,Anteil der Zweitstimmen Grüne an den Zweitstimmen in %,Anteil der Zweitstimmen Grüne an den Zweitstimmen in %,Anteil der Zweitstimmen Grüne an den Zweitstimmen in %,Anteil der Zweitstimmen FDP an den Zweitstimmen in %,Anteil der Zweitstimmen FDP an den Zweitstimmen in %,Anteil der Zweitstimmen FDP an den Zweitstimmen in %,Anteil der Zweitstimmen FDP an den Zweitstimmen in %,Anteil der Zweitstimmen FDP an den Zweitstimmen in %,Anteil der Zweitstimmen FDP an den Zweitstimmen in %,Anteil der Zweitstimmen FDP an den Zweitstimmen in %,Anteil der Zweitstimmen Die Linke an den Zweitstimmen in %,Anteil der Zweitstimmen Die Linke an den Zweitstimmen in %,Anteil der Zweitstimmen Die Linke an den Zweitstimmen in %,Anteil der Zweitstimmen Die Linke an den Zweitstimmen in %,Anteil der Zweitstimmen Die Linke an den Zweitstimmen in %,Anteil der Zweitstimmen Die Linke an den Zweitstimmen in %,Anteil der Zweitstimmen Die Linke an den Zweitstimmen in %,Anteil der Zweitstimmen AfD an den Zweitstimmen in %,Preisniveau,Preisniveau,Preisniveau,Preisniveau,Verpflichtungsrahmen Städtebauförderung insgesamt (langfristig) in € je Einwohner,Verpflichtungsrahmen Städtebauförderung insgesamt (kurzfristig) in € je Einwohner,Bewilligte Zuschüsse Gemeinschaftsaufgabe 'Verbesserung der regionalen Wirtschaftsstruktur einzelbetrieblich' (langfristig) in € je Einwohner,Bewilligte Zuschüsse Gemeinschaftsaufgabe 'Verbesserung der regionalen Wirtschaftsstruktur einzelbetrieblich' (kurzfristig) in € je Einwohner,Bewilligte Zuschüsse Gemeinschaftsaufgabe 'Verbesserung der regionalen Wirtschaftsstruktur Infrastruktur' (langfristig) in € je Einwohner,Bewilligte Zuschüsse Gemeinschaftsaufgabe 'Verbesserung der regionalen Wirtschaftsstruktur Infrastruktur' (kurzfristig) in € je Einwohner,"Ist-Ausgaben 'Gemeinschaftsaufgabe Hochschulbau', Forschungsbauten, Großgeräteförderung und Bewilligungen Exzellenzinitiative und Hochschulpakt (langfristig) in € je Einwohner","Ist-Ausgaben 'Gemeinschaftsaufgabe Hochschulbau', Forschungsbauten, Großgeräteförderung und Bewilligungen Exzellenzinitiative und Hochschulpakt (langfristig) in € je Einwohner",Zuschüsse für arbeitsmarktpolitische Hilfen (langfristig) in € je Einwohner,Zuschüsse für arbeitsmarktpolitische Hilfen (kurzfristig) in € je Einwohner,Ist-Ausgaben direkte Projektförderung ausgewählter Ressorts (langfristig) in € je Einwohner,Ist-Ausgaben direkte Projektförderung ausgewählter Ressorts (kurzfristig) in € je Einwohner
,,Berechnung,gültige Zweitstimmen Bundestagswahl <Zeitpunkt> / Wahlberechtigte <Zeitpunkt> x 100,gültige Zweitstimmen Bundestagswahl <Zeitpunkt> / Wahlberechtigte <Zeitpunkt> x 100,gültige Zweitstimmen Bundestagswahl <Zeitpunkt> / Wahlberechtigte <Zeitpunkt> x 100,gültige Zweitstimmen Bundestagswahl <Zeitpunkt> / Wahlberechtigte <Zeitpunkt> x 100,gültige Zweitstimmen Bundestagswahl <Zeitpunkt> / Wahlberechtigte <Zeitpunkt> x 100,gültige Zweitstimmen Bundestagswahl <Zeitpunkt> / Wahlberechtigte <Zeitpunkt> x 100,gültige Zweitstimmen Bundestagswahl <Zeitpunkt> / Wahlberechtigte <Zeitpunkt> x 100,gültige Zweitstimmen CDU/CSU <Zeitpunkt> / gültige Zweitstimmen <Zeitpunkt> x 100,gültige Zweitstimmen CDU/CSU <Zeitpunkt> / gültige Zweitstimmen <Zeitpunkt> x 100,gültige Zweitstimmen CDU/CSU <Zeitpunkt> / gültige Zweitstimmen <Zeitpunkt> x 100,gültige Zweitstimmen CDU/CSU <Zeitpunkt> / gültige Zweitstimmen <Zeitpunkt> x 100,gültige Zweitstimmen CDU/CSU <Zeitpunkt> / gültige Zweitstimmen <Zeitpunkt> x 100,gültige Zweitstimmen CDU/CSU <Zeitpunkt> / gültige Zweitstimmen <Zeitpunkt> x 100,gültige Zweitstimmen CDU/CSU <Zeitpunkt> / gültige Zweitstimmen <Zeitpunkt> x 100,gültige Zweitstimmen SPD <Zeitpunkt> / gültige Zweitstimmen <Zeitpunkt> x 100,gültige Zweitstimmen SPD <Zeitpunkt> / gültige Zweitstimmen <Zeitpunkt> x 100,gültige Zweitstimmen SPD <Zeitpunkt> / gültige Zweitstimmen <Zeitpunkt> x 100,gültige Zweitstimmen SPD <Zeitpunkt> / gültige Zweitstimmen <Zeitpunkt> x 100,gültige Zweitstimmen SPD <Zeitpunkt> / gültige Zweitstimmen <Zeitpunkt> x 100,gültige Zweitstimmen SPD <Zeitpunkt> / gültige Zweitstimmen <Zeitpunkt> x 100,gültige Zweitstimmen SPD <Zeitpunkt> / gültige Zweitstimmen <Zeitpunkt> x 100,gültige Zweitstimmen Grüne <Zeitpunkt> / gültige Zweitstimmen <Zeitpunkt> x 100,gültige Zweitstimmen Grüne <Zeitpunkt> / gültige Zweitstimmen <Zeitpunkt> x 100,gültige Zweitstimmen Grüne <Zeitpunkt> / gültige Zweitstimmen <Zeitpunkt> x 100,gültige Zweitstimmen Grüne <Zeitpunkt> / gültige Zweitstimmen <Zeitpunkt> x 100,gültige Zweitstimmen Grüne <Zeitpunkt> / gültige Zweitstimmen <Zeitpunkt> x 100,gültige Zweitstimmen Grüne <Zeitpunkt> / gültige Zweitstimmen <Zeitpunkt> x 100,gültige Zweitstimmen Grüne <Zeitpunkt> / gültige Zweitstimmen <Zeitpunkt> x 100,gültige Zweitstimmen FDP <Zeitpunkt> / gültige Zweitstimmen <Zeitpunkt> x 100,gültige Zweitstimmen FDP <Zeitpunkt> / gültige Zweitstimmen <Zeitpunkt> x 100,gültige Zweitstimmen FDP <Zeitpunkt> / gültige Zweitstimmen <Zeitpunkt> x 100,gültige Zweitstimmen FDP <Zeitpunkt> / gültige Zweitstimmen <Zeitpunkt> x 100,gültige Zweitstimmen FDP <Zeitpunkt> / gültige Zweitstimmen <Zeitpunkt> x 100,gültige Zweitstimmen FDP <Zeitpunkt> / gültige Zweitstimmen <Zeitpunkt> x 100,gültige Zweitstimmen FDP <Zeitpunkt> / gültige Zweitstimmen <Zeitpunkt> x 100,gültige Zweitstimmen Die Linke <Zeitpunkt> / gültige Zweitstimmen <Zeitpunkt> x 100,gültige Zweitstimmen Die Linke <Zeitpunkt> / gültige Zweitstimmen <Zeitpunkt> x 100,gültige Zweitstimmen Die Linke <Zeitpunkt> / gültige Zweitstimmen <Zeitpunkt> x 100,gültige Zweitstimmen Die Linke <Zeitpunkt> / gültige Zweitstimmen <Zeitpunkt> x 100,gültige Zweitstimmen Die Linke <Zeitpunkt> / gültige Zweitstimmen <Zeitpunkt> x 100,gültige Zweitstimmen Die Linke <Zeitpunkt> / gültige Zweitstimmen <Zeitpunkt> x 100,gültige Zweitstimmen Die Linke <Zeitpunkt> / gültige Zweitstimmen <Zeitpunkt> x 100,gültige Zweitstimmen AfD <Zeitpunkt> / gültige Zweitstimmen <Zeitpunkt> x 100,-,-,-,-,Finanzhilfen Städtebauförderung / E ,Finanzhilfen Städtebauförderung / E ,"Bewilligte Zuschüsse einschließlich Kofinanzierung Gemeinschaftsaufgabe „Verbesserung der regionalen Wirtschaftsstruktur – einzelbetrieblich"" / E ","Bewilligte Zuschüsse einschließlich Kofinanzierung Gemeinschaftsaufgabe „Verbesserung der regionalen Wirtschaftsstruktur – einzelbetrieblich"" / E ","Bewilligte Zuschüsse einschließlich Kofinanzierung Gemeinschaftsaufgabe „Verbesserung der regionalen Wirtschaftsstruktur – Infrastruktur"" / E ","Bewilligte Zuschüsse einschließlich Kofinanzierung Gemeinschaftsaufgabe „Verbesserung der regionalen Wirtschaftsstruktur – Infrastruktur"" / E ","Gemeinschaftsaufgabe Hochschulbau (Ist-Ausgaben)  +  Bund-Länder Hochschulabauten und Großgeräteförderung (Ist-Ausgaben) + Bewilligungen Bund-Länder Hochschulpakt und Exzellenzinitiative <Summe der Jahre> / E <Zeitpunkt>
",Gemeinschaftsaufgabe Hochschulbau (Ist-Ausgaben) / E ,"Zuschüsse zu Arbeitsbeschaffungsmaßnahmen, Strukturanpassungsmaßnahmen und Beschäftigung schaffenden Infrastrukturmaßnahmen / E ","Zuschüsse zu Arbeitsbeschaffungsmaßnahmen, Strukturanpassungsmaßnahmen und Beschäftigung schaffenden Infrastrukturmaßnahmen / E ",Direkte Projektförderung / E ,Direkte Projektförderung / E 
,,Einheit,Prozent,Prozent,Prozent,Prozent,Prozent,Prozent,Prozent,Prozent,Prozent,Prozent,Prozent,Prozent,Prozent,Prozent,Prozent,Prozent,Prozent,Prozent,Prozent,Prozent,Prozent,Prozent,Prozent,Prozent,Prozent,Prozent,Prozent,Prozent,Prozent,Prozent,Prozent,Prozent,Prozent,Prozent,Prozent,Prozent,Prozent,Prozent,Prozent,Prozent,Prozent,Prozent,Prozent,Index mit Bundesdurchschnitt = 100,Index mit Bundesdurchschnitt = 100,Index mit Bundesdurchschnitt = 100,Index mit Bundesdurchschnitt = 100,Euro je Einwohner,Euro je Einwohner,Euro je Einwohner,Euro je Einwohner,Euro je Einwohner,Euro je Einwohner,Euro je Einwohner,Euro je Einwohner,Euro je Einwohner,Euro je Einwohner,Euro je Einwohner,Euro je Einwohner
,,Anmerkungen,-,-,-,-,-,-,-,-,-,-,-,-,-,-,-,-,-,-,-,-,-,-,-,-,-,-,-,-,-,-,-,-,-,-,-,-,-,-,-,-,-,-,-,"Der regionale Preisindex basiert auf ökonmetrischen Berechnungen auf Grundlage von Ausgangsdaten des Statistischen Bundesamt und der Statistischen Landesämter zu Miet-, Güter- und Dienstleistungspreisen.",Der regionale Preisindex basiert auf ökonmetrischen Berechnungen auf Grundlage von Ausgangsdaten des Statistischen Bundesamt und der Statistischen Landesämter zu Mietpreisen.,Der regionale Preisindex basiert auf ökonmetrischen Berechnungen auf Grundlage von Ausgangsdaten des Statistischen Bundesamt und der Statistischen Landesämter zu Güterpreisen.,Der regionale Preisindex basiert auf ökonmetrischen Berechnungen auf Grundlage von Ausgangsdaten des Statistischen Bundesamt und der Statistischen Landesämter zu Dienstleistungspreisen.,"Bevölkerung 2011,2015: Fortschreibung Zensus 2011; Vorjahre: Fortschreibung Volkszählung 1987. - Finanzhilfen Städtebauförderung. Enthält die Programmbereiche Sanierung und Entwicklung, Städtebaulicher Denkmalschutz, Soziale Stadt, Stadtumbau Ost, Stadtumbau West, Aktive Stadt- und Ortsteilzentren.","Bevölkerung 2011,2015: Fortschreibung Zensus 2011; Vorjahre: Fortschreibung Volkszählung 1987. - Finanzhilfen Städtebauförderung. Enthält die Programmbereiche Sanierung und Entwicklung, Städtebaulicher Denkmalschutz, Soziale Stadt, Stadtumbau Ost, Stadtumbau West, Aktive Stadt- und Ortsteilzentren.","Bevölkerung 2011,2015: Fortschreibung Zensus 2011; Vorjahre: Fortschreibung Volkszählung 1987. - Bewilligte Zuschüsse einschließlich Kofinanzierung für einzelbetriebliche Maßnahmen im Rahmen der Gemeinschaftsaufgabe 'Verbesserung der regionalen Wirtschaftsstruktur' . Enthält neben dem Bundes- auch den Landes- und den EFRE-(= EU-Struktur-Förderung).","Bevölkerung 2011,2015: Fortschreibung Zensus 2011; Vorjahre: Fortschreibung Volkszählung 1987. - Bewilligte Zuschüsse einschließlich Kofinanzierung für einzelbetriebliche Maßnahmen im Rahmen der Gemeinschaftsaufgabe 'Verbesserung der regionalen Wirtschaftsstruktur' . Enthält neben dem Bundes- auch den Landes- und den EFRE-(= EU-Struktur-Förderung).","Bevölkerung 2011,2015: Fortschreibung Zensus 2011; Vorjahre: Fortschreibung Volkszählung 1987. - Bewilligte Zuschüsse einschließlich Kofinanzierung für Infrastrukturmaßnahmen im Rahmen der Gemeinschaftsaufgabe 'Verbesserung der regionalen Wirtschaftsstruktur'. Enthält neben dem Bundes- auch den Landes- und den EFRE-(= EU-Struktur-Förderung).","Bevölkerung 2011,2015: Fortschreibung Zensus 2011; Vorjahre: Fortschreibung Volkszählung 1987. - Bewilligte Zuschüsse einschließlich Kofinanzierung für Infrastrukturmaßnahmen im Rahmen der Gemeinschaftsaufgabe 'Verbesserung der regionalen Wirtschaftsstruktur'. Enthält neben dem Bundes- auch den Landes- und den EFRE-(= EU-Struktur-Förderung).","Bevölkerung 2011,2015: Fortschreibung Zensus 2011; Vorjahre: Fortschreibung Volkszählung 1987. - Ist-Ausgaben im Rahmen der Gemeinschaftsaufgabe 'Hochschulbau' und Zusammenwirken von Bund und Ländern bei Forschungsbauten an Hochschulen (ohne Großgeräte).","Bevölkerung 2011,2015: Fortschreibung Zensus 2011; Vorjahre: Fortschreibung Volkszählung 1987. - Ist-Ausgaben im Rahmen der Gemeinschaftsaufgabe 'Hochschulbau' und Zusammenwirken von Bund und Ländern bei Forschungsbauten an Hochschulen (ohne Großgeräte).","Bevölkerung 2011,2015: Fortschreibung Zensus 2011; Vorjahre: Fortschreibung Volkszählung 1987. - Zuschüsse zu Arbeitsbeschaffungsmaßnahmen, Strukturanpassungsmaßnahmen und Beschäftigung schaffenden Infrastrukturmaßnahmen.","Bevölkerung 2011,2015: Fortschreibung Zensus 2011; Vorjahre: Fortschreibung Volkszählung 1987. - Zuschüsse zu Arbeitsbeschaffungsmaßnahmen, Strukturanpassungsmaßnahmen und Beschäftigung schaffenden Infrastrukturmaßnahmen.","Bevölkerung 2011,2015: Fortschreibung Zensus 2011; Vorjahre: Fortschreibung Volkszählung 1987. - Direkt geförderte Projekte der Ressorts BMBF, BMEL, BMFSFJ, BMI-BAMF, BMUB, BMVI, BMWi","Bevölkerung 2011,2015: Fortschreibung Zensus 2011; Vorjahre: Fortschreibung Volkszählung 1987. - Direkt geförderte Projekte der Ressorts BMBF, BMEL, BMFSFJ, BMI-BAMF, BMUB, BMVI, BMWi"
,,Quelle,Allgemeine Bundestagswahlstatistik des Bundes und der Länder,Allgemeine Bundestagswahlstatistik des Bundes und der Länder,Allgemeine Bundestagswahlstatistik des Bundes und der Länder,Allgemeine Bundestagswahlstatistik des Bundes und der Länder,Allgemeine Bundestagswahlstatistik des Bundes und der Länder,Allgemeine Bundestagswahlstatistik des Bundes und der Länder,Allgemeine Bundestagswahlstatistik des Bundes und der Länder,Allgemeine Bundestagswahlstatistik des Bundes und der Länder,Allgemeine Bundestagswahlstatistik des Bundes und der Länder,Allgemeine Bundestagswahlstatistik des Bundes und der Länder,Allgemeine Bundestagswahlstatistik des Bundes und der Länder,Allgemeine Bundestagswahlstatistik des Bundes und der Länder,Allgemeine Bundestagswahlstatistik des Bundes und der Länder,Allgemeine Bundestagswahlstatistik des Bundes und der Länder,Allgemeine Bundestagswahlstatistik des Bundes und der Länder,Allgemeine Bundestagswahlstatistik des Bundes und der Länder,Allgemeine Bundestagswahlstatistik des Bundes und der Länder,Allgemeine Bundestagswahlstatistik des Bundes und der Länder,Allgemeine Bundestagswahlstatistik des Bundes und der Länder,Allgemeine Bundestagswahlstatistik des Bundes und der Länder,Allgemeine Bundestagswahlstatistik des Bundes und der Länder,Allgemeine Bundestagswahlstatistik des Bundes und der Länder,Allgemeine Bundestagswahlstatistik des Bundes und der Länder,Allgemeine Bundestagswahlstatistik des Bundes und der Länder,Allgemeine Bundestagswahlstatistik des Bundes und der Länder,Allgemeine Bundestagswahlstatistik des Bundes und der Länder,Allgemeine Bundestagswahlstatistik des Bundes und der Länder,Allgemeine Bundestagswahlstatistik des Bundes und der Länder,Allgemeine Bundestagswahlstatistik des Bundes und der Länder,Allgemeine Bundestagswahlstatistik des Bundes und der Länder,Allgemeine Bundestagswahlstatistik des Bundes und der Länder,Allgemeine Bundestagswahlstatistik des Bundes und der Länder,Allgemeine Bundestagswahlstatistik des Bundes und der Länder,Allgemeine Bundestagswahlstatistik des Bundes und der Länder,Allgemeine Bundestagswahlstatistik des Bundes und der Länder,Allgemeine Bundestagswahlstatistik des Bundes und der Länder,Allgemeine Bundestagswahlstatistik des Bundes und der Länder,Allgemeine Bundestagswahlstatistik des Bundes und der Länder,Allgemeine Bundestagswahlstatistik des Bundes und der Länder,Allgemeine Bundestagswahlstatistik des Bundes und der Länder,Allgemeine Bundestagswahlstatistik des Bundes und der Länder,Allgemeine Bundestagswahlstatistik des Bundes und der Länder,Allgemeine Bundestagswahlstatistik des Bundes und der Länder,Weinand und von Auer (2019),Weinand und von Auer (2019),Weinand und von Auer (2019),Weinand und von Auer (2019),"Datenbank ""Raumwirksame Mittel"" des BBSR","Datenbank ""Raumwirksame Mittel"" des BBSR","Datenbank ""Raumwirksame Mittel"" des BBSR","Datenbank ""Raumwirksame Mittel"" des BBSR","Datenbank ""Raumwirksame Mittel"" des BBSR","Datenbank ""Raumwirksame Mittel"" des BBSR","Datenbank ""Raumwirksame Mittel"" des BBSR","Datenbank ""Raumwirksame Mittel"" des BBSR","Datenbank ""Raumwirksame Mittel"" des BBSR","Datenbank ""Raumwirksame Mittel"" des BBSR","Datenbank ""Raumwirksame Mittel"" des BBSR","Datenbank ""Raumwirksame Mittel"" des BBSR"
,,Standardisierung,HIB,HIB,HIB,HIB,HIB,HIB,HIB,HIB,HIB,HIB,HIB,HIB,HIB,HIB,HIB,HIB,HIB,HIB,HIB,HIB,HIB,HIB,HIB,HIB,HIB,HIB,HIB,HIB,HIB,HIB,HIB,HIB,HIB,HIB,HIB,HIB,HIB,HIB,HIB,HIB,HIB,HIB,HIB,HIB,HIB,HIB,HIB,HIB,HIB,HIB,HIB,HIB,HIB,HIB,HIB,HIB,HIB,HIB,HIB
Kennziffer,Raumeinheit,Aggregat,Wahlbeteiligung,Wahlbeteiligung,Wahlbeteiligung,Wahlbeteiligung,Wahlbeteiligung,Wahlbeteiligung,Wahlbeteiligung,Stimmenanteile CDU/CSU,Stimmenanteile CDU/CSU,Stimmenanteile CDU/CSU,Stimmenanteile CDU/CSU,Stimmenanteile CDU/CSU,Stimmenanteile CDU/CSU,Stimmenanteile CDU/CSU,Stimmenanteile SPD,Stimmenanteile SPD,Stimmenanteile SPD,Stimmenanteile SPD,Stimmenanteile SPD,Stimmenanteile SPD,Stimmenanteile SPD,Stimmenanteile Grüne,Stimmenanteile Grüne,Stimmenanteile Grüne,Stimmenanteile Grüne,Stimmenanteile Grüne,Stimmenanteile Grüne,Stimmenanteile Grüne,Stimmenanteile FDP,Stimmenanteile FDP,Stimmenanteile FDP,Stimmenanteile FDP,Stimmenanteile FDP,Stimmenanteile FDP,Stimmenanteile FDP,Stimmenanteile Die Linke,Stimmenanteile Die Linke,Stimmenanteile Die Linke,Stimmenanteile Die Linke,Stimmenanteile Die Linke,Stimmenanteile Die Linke,Stimmenanteile Die Linke,Stimmenanteile AfD,Preisniveau,Mietpreisniveau,Güterpreisniveau,Dienstleistungspreisniveau,Städtebauförderung (langfristig),Städtebauförderung (kurzfristig),GRW gewerbliche Wirtschaft (langfristig),GRW gewerbliche Wirtschaft (kurzfristig),GRW Infrastruktur (langfristig),GRW Infrastruktur (kurzfristig),Hochschulförderung (langfristig),Hochschulförderung (kurzfristig),Arbeitsmarktpolitische Hilfen (langfristig),Arbeitsmarktpolitische Hilfen (kurzfristig),Direkte Projektförderung (langfristig),Direkte Projektförderung (kurzfristig)
,,,1994,1998,2002,2005,2009,2013,2017,1994,1998,2002,2005,2009,2013,2017,1994,1998,2002,2005,2009,2013,2017,1994,1998,2002,2005,2009,2013,2017,1994,1998,2002,2005,2009,2013,2017,1994,1998,2002,2005,2009,2013,2017,2017,2016,2016,2016,2016,2008-17,2013-17,2008-17,2013-17,2008-17,2013-17,2008-17,2013-17,2008-17,2013-17,2008-17,2013-17
01001,"Flensburg, Stadt",krsfr. Stadt,75.1,75.8,73.9,72.0,65.8,65.8,70.3,34.4,29.2,29.6,28.8,24.7,30.6,27.2,46.6,51.1,48.2,43.5,28.0,35.6,24.6,9.0,7.7,11.4,10.4,16.1,11.9,15.1,6.6,6.4,7.1,8.7,14.4,4.5,10.3,1.4,1.8,1.8,6.4,11.6,8.2,11.6,7.5,98.0,95.9,101.3,92.7,176.5,126.2,156.6,139.6,62.6,0.0,3.9,2.2,4596.2,2047.2,185.3,98.0
01002,"Kiel, Stadt",krsfr. Stadt,77.9,78.7,77.2,75.9,70.6,69.7,73.5,33.2,28.0,26.9,27.8,24.4,29.1,25.9,44.5,49.2,45.1,42.3,30.0,35.3,24.1,11.9,10.3,15.3,13.1,17.6,14.4,17.5,6.2,6.9,8.0,8.4,12.9,5.1,11.4,2.0,2.4,2.3,6.2,9.9,7.3,10.7,6.9,101.9,109.4,101.0,98.0,66.0,45.8,74.8,50.2,58.4,53.4,701.5,352.2,3497.1,1600.1,1247.6,545.2
01003,"Lübeck, Stadt",krsfr. Stadt,76.5,77.1,75.4,71.7,66.5,67.0,70.7,39.0,32.6,31.3,30.6,26.6,33.7,28.9,43.0,48.1,48.2,44.0,30.5,34.5,25.5,8.5,7.5,9.9,9.2,13.9,11.2,12.9,5.7,6.3,6.5,8.3,14.0,4.7,10.7,1.4,1.8,1.6,5.7,10.1,6.6,9.7,8.9,103.0,109.9,100.7,102.2,25.5,6.1,98.2,54.0,93.0,36.9,188.7,128.7,3473.0,1598.0,501.7,267.6
01004,"Neumünster, Stadt",krsfr. Stadt,74.5,75.9,73.8,71.4,63.8,64.5,66.0,38.9,31.7,33.5,33.3,30.1,36.0,31.1,45.6,52.2,48.5,42.4,31.0,35.8,25.7,6.1,4.9,6.6,6.5,11.0,7.5,10.5,6.1,5.8,7.2,9.4,15.0,4.9,12.1,1.1,1.6,1.3,5.1,8.4,5.5,7.1,10.3,96.0,83.3,99.6,99.9,45.7,23.2,60.3,30.1,3.5,3.5,0.0,0.0,4710.6,2041.0,56.5,21.9
01051,Dithmarschen,Landkreis,78.6,79.5,76.8,76.0,69.2,68.5,72.2,45.3,40.3,40.8,41.7,36.5,43.5,36.7,39.0,44.2,41.7,35.7,24.3,30.2,23.4,6.0,4.1,5.4,5.1,8.4,6.3,8.0,7.1,7.0,8.5,10.5,18.8,6.5,14.6,0.7,1.1,1.3,4.5,7.9,4.8,6.2,8.6,98.1,97.5,99.8,95.0,41.9,24.2,113.5,79.0,61.7,7.9,0.1,0.0,3188.6,1562.9,110.1,50.1
01053,Herzogtum Lauenburg,Landkreis,81.9,83.2,80.9,79.4,74.1,73.9,76.8,43.6,36.9,38.0,36.9,32.6,40.2,34.2,36.4,43.6,40.9,36.7,26.1,29.9,23.0,8.5,6.2,8.9,8.6,12.1,9.0,10.5,7.7,7.7,8.0,10.8,16.9,5.8,12.8,1.2,1.5,1.2,4.6,8.2,5.2,6.6,10.2,99.5,104.1,98.5,98.0,36.5,22.0,31.3,12.7,13.3,1.6,5.9,3.1,3161.6,1443.7,678.3,446.9
01054,Nordfriesland,Landkreis,78.0,79.8,79.5,77.2,70.6,70.4,74.7,42.6,38.3,39.3,41.4,36.3,43.1,38.7,38.8,43.6,42.8,36.4,24.6,29.5,22.2,7.7,6.1,7.1,6.7,12.6,8.8,12.1,8.7,8.0,8.1,9.9,16.5,6.4,12.6,0.7,1.2,1.1,3.6,6.3,4.2,6.3,5.8,97.2,95.4,101.0,91.0,21.7,11.5,169.2,80.1,149.8,73.2,0.0,0.0,2848.4,1264.3,49.1,24.5
01055,Ostholstein,Landkreis,79.9,81.4,79.7,78.0,71.3,72.2,75.3,44.5,38.1,38.5,37.9,32.8,41.1,35.6,39.1,44.8,44.0,38.7,28.4,31.7,24.8,6.5,5.0,7.0,6.6,10.5,7.9,9.7,7.2,7.5,7.8,10.4,17.7,6.3,13.3,0.9,1.2,0.9,4.2,7.2,4.3,6.0,8.5,99.9,103.4,99.2,98.6,70.7,62.4,177.4,112.1,171.1,80.5,0.0,0.0,2242.9,1011.4,27.2,17.4
01056,Pinneberg,Landkreis,83.0,83.8,82.9,80.7,74.3,75.3,78.1,41.2,35.4,35.5,36.8,33.1,40.6,34.3,38.0,44.9,41.6,37.4,26.3,31.2,22.9,9.0,6.6,10.2,9.1,12.1,8.6,11.4,8.4,8.3,8.3,10.3,16.6,5.6,13.3,1.2,1.5,1.2,4.4,7.8,5.0,7.0,8.6,105.8,125.9,100.7,101.7,53.5,28.5,0.5,0.5,8.2,6.2,0.3,0.2,2929.7,1336.9,49.7,19.3
01057,Plön,Landkreis,83.3,84.8,83.3,81.3,75.9,76.2,79.6,42.7,36.9,36.5,37.3,32.7,39.7,34.2,40.0,45.1,42.9,38.5,27.6,31.6,23.2,7.7,6.3,9.6,8.4,13.6,10.2,13.6,6.7,7.2,7.8,9.5,16.1,5.6,12.8,1.1,1.4,1.2,4.1,6.5,4.4,6.3,7.7,98.9,96.7,100.1,98.4,18.7,10.8,14.6,8.1,19.6,6.9,6.6,4.6,2020.0,853.1,48.7,22.5
01058,Rendsburg-Eckernförde,Landkreis,81.6,82.6,81.2,79.8,74.5,74.9,78.2,42.0,36.7,37.4,38.1,33.9,40.8,36.1,39.4,44.5,42.1,37.3,26.6,31.3,22.7,7.8,6.3,9.3,8.2,12.9,9.4,12.6,8.0,8.2,8.2,10.1,16.1,5.6,12.4,0.9,1.3,1.2,4.1,6.5,4.3,6.3,7.3,96.3,91.6,99.9,92.9,81.1,26.5,24.0,17.0,87.3,4.4,0.0,0.0,2249.6,1010.8,88.7,45.8
01059,Schleswig-Flensburg,Landkreis,80.6,81.8,80.1,78.6,72.8,73.0,76.5,43.0,37.9,39.1,39.4,35.0,41.3,37.1,40.1,45.6,42.4,37.3,25.5,31.4,23.3,7.3,5.8,8.2,7.1,12.9,8.9,12.3,7.1,6.7,7.6,10.1,15.5,5.2,11.5,0.8,1.1,1.1,4.2,7.2,4.6,6.9,6.6,97.1,89.4,99.6,98.6,11.5,9.8,122.4,25.9,70.8,49.0,3.4,2.2,3092.0,1349.6,28.3,13.5
01060,Segeberg,Landkreis,80.5,82.1,80.6,79.2,72.9,73.4,76.5,44.4,37.5,37.5,37.4,33.5,41.7,35.2,36.2,43.4,40.5,36.0,24.8,29.8,22.2,7.8,5.8,8.8,8.1,11.4,8.2,10.5,8.3,8.6,9.1,11.6,17.9,5.8,13.5,1.1,1.5,1.2,4.4,8.1,4.9,6.8,9.0,105.6,138.0,100.6,93.7,8.6,3.9,0.0,0.0,0.0,0.0,6.8,2.2,2520.2,1214.1,77.4,33.4
01061,Steinburg,Landkreis,80.0,81.5,79.9,77.8,71.1,71.5,74.8,42.3,36.7,37.5,37.6,33.6,41.0,36.1,40.4,45.6,41.9,37.4,26.0,30.5,23.0,7.6,5.6,8.4,7.0,11.0,8.0,10.6,7.2,7.6,8.5,10.3,16.7,5.8,12.3,0.9,1.2,1.3,4.6,7.9,5.3,7.0,8.2,96.9,92.5,99.5,95.3,69.1,40.6,184.5,60.5,34.5,23.5,0.7,0.5,2934.4,1360.2,178.8,80.9
01062,Stormarn,Landkreis,83.9,84.8,83.9,81.9,76.2,76.8,80.4,43.0,36.6,36.7,37.1,33.4,40.7,34.6,35.3,42.8,40.1,35.6,24.9,29.7,21.7,9.4,7.1,10.6,9.9,13.1,9.6,11.7,8.8,8.7,8.4,11.3,17.5,6.0,14.0,1.1,1.4,1.2,4.2,7.5,4.7,6.5,9.1,102.2,114.8,98.3,100.8,35.6,19.8,0.0,0.0,0.0,0.0,1.1,0.3,2091.3,946.7,75.6,46.1
02000,"Hamburg, Stadt",krsfr. Stadt,79.1,80.2,78.9,76.7,70.5,69.5,75.4,34.9,30.0,28.1,28.9,27.8,32.1,27.2,39.7,45.7,42.0,38.7,27.4,32.4,23.5,12.6,10.8,16.2,14.9,15.6,12.7,13.9,7.2,6.5,6.8,9.0,13.2,4.8,10.8,2.2,2.3,2.1,6.3,11.2,8.8,12.2,7.8,106.7,129.9,101.1,101.7,46.8,28.6,0.0,0.0,0.0,0.0,127.1,75.5,3066.1,1456.1,914.8,374.8
03101,"Braunschweig, Stadt",krsfr. Stadt,80.8,82.3,79.1,77.4,72.9,73.4,76.4,39.8,30.4,29.8,28.9,29.0,34.0,29.0,39.6,50.1,49.7,44.5,28.7,33.6,26.4,9.0,8.2,10.0,9.9,14.3,12.4,11.8,7.6,6.7,6.9,8.5,11.4,4.4,10.0,1.5,1.3,1.6,5.6,9.9,6.7,9.3,8.4,101.1,104.9,99.9,100.3,29.2,18.4,21.0,11.5,76.9,0.0,462.1,267.2,2614.7,1167.7,1632.5,695.8
03102,"Salzgitter, Stadt",krsfr. Stadt,79.6,81.3,76.8,75.4,69.3,67.8,70.9,40.1,30.6,31.5,29.5,29.6,33.2,26.0,47.2,58.1,55.7,50.8,36.3,41.9,33.6,4.5,3.0,4.0,4.3,7.0,5.8,4.8,4.5,4.0,5.2,6.2,8.9,3.0,6.6,0.9,0.9,0.9,5.7,12.3,6.9,8.2,16.4,96.1,86.1,99.2,98.6,45.4,29.8,0.0,0.0,0.0,0.0,0.0,0.0,3025.6,1472.6,202.0,63.2
03103,"Wolfsburg, Stadt",krsfr. Stadt,81.1,82.4,79.1,76.0,69.6,68.9,73.2,45.1,35.2,34.0,32.1,35.0,41.9,34.1,41.0,51.2,52.3,46.5,31.7,34.0,28.9,4.9,4.3,5.5,6.2,9.1,6.9,6.2,5.5,5.0,5.2,7.6,9.7,3.7,8.3,0.8,0.7,0.8,4.5,8.5,5.1,7.2,11.7,102.0,111.6,98.4,102.3,54.4,44.6,0.0,0.0,0.0,0.0,0.0,0.0,2520.7,1058.5,634.4,202.9
